text,label,rating,cleaned_text,vader_sentiment,vader_score,textblob_sentiment,textblob_polarity,lr_sentiment,true_sentiment
"Cheap and flimsy, do not recommend at all.",Negative,1,cheap and flimsy do not recommend at all,Negative,-0.2755,Positive,0.4,Negative,Negative
Worst product I've ever bought.,Negative,1,worst product ive ever bought,Negative,-0.6249,Negative,-1.0,Negative,Negative
"Very disappointing, the product is nothing like advertised.",Negative,1,very disappointing the product is nothing like advertised,Negative,-0.6811,Negative,-0.78,Negative,Negative
"Awful product, does not work at all.",Negative,1,awful product does not work at all,Negative,-0.4588,Negative,-1.0,Negative,Negative
"The quality is absolutely terrible, very disappointed.",Negative,1,the quality is absolutely terrible very disappointed,Negative,-0.7935,Negative,-0.9875,Negative,Negative
"Completely useless, wasted my money.",Negative,1,completely useless wasted my money,Negative,-0.763,Negative,-0.35,Negative,Negative
Great customer support and fantastic product.,Positive,5,great customer support and fantastic product,Positive,0.886,Positive,0.6000000000000001,Positive,Positive
"Really good quality, arrived quickly and well packaged.",Positive,5,really good quality arrived quickly and well packaged,Positive,0.6478,Positive,0.5166666666666666,Positive,Positive
The item was defective and customer service was no help.,Negative,1,the item was defective and customer service was no help,Negative,-0.34,Neutral,0.0,Negative,Negative
The product is top notch and the delivery was fast.,Positive,5,the product is top notch and the delivery was fast,Positive,0.2023,Positive,0.35,Positive,Positive
The product arrived on time but the packaging was poor.,Neutral,3,the product arrived on time but the packaging was poor,Negative,-0.631,Negative,-0.4,Neutral,Neutral
"Fell apart during first use, total garbage.",Negative,1,fell apart during first use total garbage,Neutral,0.0,Positive,0.125,Negative,Negative
"Perfect condition, works exactly as shown in the description.",Positive,5,perfect condition works exactly as shown in the description,Positive,0.5719,Positive,0.625,Positive,Positive
Really impressed with the durability and finish.,Positive,5,really impressed with the durability and finish,Positive,0.5256,Positive,1.0,Positive,Positive
This is the worst purchase I have ever made.,Negative,1,this is the worst purchase i have ever made,Negative,-0.6249,Negative,-1.0,Negative,Negative
It does the job but I have seen better.,Neutral,3,it does the job but i have seen better,Positive,0.5927,Positive,0.5,Neutral,Neutral
Terrible customer service and even worse product.,Negative,1,terrible customer service and even worse product,Negative,-0.7351,Negative,-0.7,Negative,Negative
I would give zero stars if I could.,Negative,1,i would give zero stars if i could,Neutral,0.0,Neutral,0.0,Negative,Negative
Disappointed with this purchase.,Negative,1,disappointed with this purchase,Negative,-0.4767,Negative,-0.75,Negative,Negative
Best investment I have made in a long time.,Positive,5,best investment i have made in a long time,Positive,0.6369,Positive,0.475,Positive,Positive
The item was defective and customer service was no help.,Negative,1,the item was defective and customer service was no help,Negative,-0.34,Neutral,0.0,Negative,Negative
"It's okay, does the job.",Neutral,3,its okay does the job,Positive,0.2263,Positive,0.5,Neutral,Neutral
The packaging was great and the product works flawlessly.,Positive,5,the packaging was great and the product works flawlessly,Positive,0.7096,Positive,0.9,Positive,Positive
"Disgusting quality, sent it back immediately.",Negative,1,disgusting quality sent it back immediately,Negative,-0.5267,Negative,-0.5,Negative,Negative
"Useless product, complete waste of money.",Negative,1,useless product complete waste of money,Negative,-0.6808,Negative,-0.20000000000000004,Negative,Negative
Acceptable quality for the price I paid.,Neutral,3,acceptable quality for the price i paid,Positive,0.3182,Neutral,0.0,Neutral,Neutral
"Incredible value for money, I am very impressed.",Positive,5,incredible value for money i am very impressed,Positive,0.6997,Positive,0.95,Positive,Positive
"Disgusting quality, sent it back immediately.",Negative,1,disgusting quality sent it back immediately,Negative,-0.5267,Negative,-0.5,Negative,Negative
"It does what it says, nothing more nothing less.",Neutral,3,it does what it says nothing more nothing less,Neutral,0.0,Positive,0.16666666666666669,Neutral,Neutral
Mediocre quality at a reasonable price.,Neutral,3,mediocre quality at a reasonable price,Neutral,0.0,Negative,-0.15,Neutral,Neutral
The product is top notch and the delivery was fast.,Positive,5,the product is top notch and the delivery was fast,Positive,0.2023,Positive,0.35,Positive,Positive
The item was defective and customer service was no help.,Negative,1,the item was defective and customer service was no help,Negative,-0.34,Neutral,0.0,Negative,Negative
Really impressed with the durability and finish.,Positive,5,really impressed with the durability and finish,Positive,0.5256,Positive,1.0,Positive,Positive
"Amazing quality and very affordable, highly recommend.",Positive,5,amazing quality and very affordable highly recommend,Positive,0.7818,Positive,0.32,Positive,Positive
Nothing special but it works.,Neutral,3,nothing special but it works,Negative,-0.1603,Positive,0.35714285714285715,Neutral,Neutral
"I love this product, it has made my life so much easier.",Positive,5,i love this product it has made my life so much easier,Positive,0.8062,Positive,0.35,Positive,Positive
"Incredible value for money, I am very impressed.",Positive,5,incredible value for money i am very impressed,Positive,0.6997,Positive,0.95,Positive,Positive
Best investment I have made in a long time.,Positive,5,best investment i have made in a long time,Positive,0.6369,Positive,0.475,Positive,Positive
This is the worst purchase I have ever made.,Negative,1,this is the worst purchase i have ever made,Negative,-0.6249,Negative,-1.0,Negative,Negative
"Disgusting quality, sent it back immediately.",Negative,1,disgusting quality sent it back immediately,Negative,-0.5267,Negative,-0.5,Negative,Negative
Functional but the design could use improvement.,Neutral,3,functional but the design could use improvement,Positive,0.6124,Neutral,0.0,Neutral,Neutral
Best purchase I've made this year.,Positive,5,best purchase ive made this year,Positive,0.6369,Positive,1.0,Positive,Positive
"Terrible product, broke after one use.",Negative,1,terrible product broke after one use,Negative,-0.7096,Negative,-1.0,Negative,Negative
Very pleased with the quality and functionality.,Positive,5,very pleased with the quality and functionality,Positive,0.4927,Positive,0.65,Positive,Positive
Exceeded my expectations in every way possible.,Positive,5,exceeded my expectations in every way possible,Neutral,0.0,Neutral,0.0,Positive,Positive
I use it daily and it has held up perfectly.,Positive,5,i use it daily and it has held up perfectly,Positive,0.6369,Positive,0.5,Positive,Positive
"Awful product, does not work at all.",Negative,1,awful product does not work at all,Negative,-0.4588,Negative,-1.0,Negative,Negative
"I regret buying this, complete waste.",Negative,1,i regret buying this complete waste,Negative,-0.6808,Neutral,-0.05,Negative,Negative
"Decent enough, no issues so far.",Neutral,3,decent enough no issues so far,Negative,-0.296,Neutral,0.08888888888888889,Neutral,Neutral
"Amazing quality and very affordable, highly recommend.",Positive,5,amazing quality and very affordable highly recommend,Positive,0.7818,Positive,0.32,Positive,Positive
Do not waste your money on this junk.,Negative,1,do not waste your money on this junk,Positive,0.3252,Neutral,0.1,Negative,Negative
Middle of the road product.,Neutral,3,middle of the road product,Neutral,0.0,Neutral,0.0,Neutral,Neutral
Reasonable for a budget option.,Neutral,3,reasonable for a budget option,Neutral,0.0,Positive,0.2,Neutral,Neutral
Great quality for the price.,Positive,5,great quality for the price,Positive,0.6249,Positive,0.8,Positive,Positive
"Highly recommended, the customer service was also excellent.",Positive,5,highly recommended the customer service was also excellent,Positive,0.6997,Positive,0.58,Positive,Positive
The product works but feels a bit cheap.,Neutral,3,the product works but feels a bit cheap,Neutral,0.0,Positive,0.4,Neutral,Neutral
Reasonable for a budget option.,Neutral,3,reasonable for a budget option,Neutral,0.0,Positive,0.2,Neutral,Neutral
Absolutely wonderful. Five stars!,Positive,5,absolutely wonderful five stars,Positive,0.6115,Positive,1.0,Positive,Positive
Very impressed with the quality and the fast shipping.,Positive,5,very impressed with the quality and the fast shipping,Positive,0.5256,Positive,0.6,Positive,Positive
Not bad but not great either.,Neutral,3,not bad but not great either,Negative,-0.5448,Neutral,-0.02500000000000005,Neutral,Neutral
The product arrived damaged and unusable.,Negative,1,the product arrived damaged and unusable,Negative,-0.4404,Neutral,0.0,Negative,Negative
The item was defective and customer service was no help.,Negative,1,the item was defective and customer service was no help,Negative,-0.34,Neutral,0.0,Negative,Negative
The packaging was great and the product works flawlessly.,Positive,5,the packaging was great and the product works flawlessly,Positive,0.7096,Positive,0.9,Positive,Positive
I expected a bit more for the price.,Neutral,3,i expected a bit more for the price,Neutral,0.0,Positive,0.2,Neutral,Neutral
There are better options but this is fine.,Neutral,3,there are better options but this is fine,Positive,0.4854,Positive,0.45833333333333337,Neutral,Neutral
The product arrived damaged and unusable.,Negative,1,the product arrived damaged and unusable,Negative,-0.4404,Neutral,0.0,Negative,Negative
The product description was accurate.,Neutral,3,the product description was accurate,Neutral,0.0,Positive,0.4000000000000001,Neutral,Neutral
"Avoid at all costs, this is not worth it.",Negative,1,avoid at all costs this is not worth it,Negative,-0.434,Negative,-0.15,Negative,Negative
Very impressed with the quality and the fast shipping.,Positive,5,very impressed with the quality and the fast shipping,Positive,0.5256,Positive,0.6,Positive,Positive
"Avoid at all costs, this is not worth it.",Negative,1,avoid at all costs this is not worth it,Negative,-0.434,Negative,-0.15,Negative,Negative
"Very good product for the price, satisfied.",Positive,5,very good product for the price satisfied,Positive,0.7178,Positive,0.705,Positive,Positive
Fantastic build quality and very easy to use.,Positive,5,fantastic build quality and very easy to use,Positive,0.7778,Positive,0.4816666666666667,Positive,Positive
Good enough for occasional use.,Neutral,3,good enough for occasional use,Positive,0.4404,Positive,0.2333333333333333,Neutral,Neutral
Worst product I've ever bought.,Negative,1,worst product ive ever bought,Negative,-0.6249,Negative,-1.0,Negative,Negative
"The product broke under normal use, very poor.",Negative,1,the product broke under normal use very poor,Negative,-0.7346,Negative,-0.185,Negative,Negative
The product description was accurate.,Neutral,3,the product description was accurate,Neutral,0.0,Positive,0.4000000000000001,Neutral,Neutral
"Very disappointing, the product is nothing like advertised.",Negative,1,very disappointing the product is nothing like advertised,Negative,-0.6811,Negative,-0.78,Negative,Negative
One of the best products I have ever bought online.,Positive,5,one of the best products i have ever bought online,Positive,0.6369,Positive,1.0,Positive,Positive
"Works perfectly, highly recommend.",Positive,5,works perfectly highly recommend,Positive,0.7902,Positive,0.16,Positive,Positive
"It stopped working after two days, unacceptable.",Negative,1,it stopped working after two days unacceptable,Negative,-0.5994,Neutral,0.0,Negative,Negative
I have mixed feelings about this purchase.,Neutral,3,i have mixed feelings about this purchase,Neutral,0.0,Neutral,0.0,Neutral,Neutral
Great quality materials and good construction.,Positive,5,great quality materials and good construction,Positive,0.7906,Positive,0.75,Positive,Positive
"Incredible value for money, I am very impressed.",Positive,5,incredible value for money i am very impressed,Positive,0.6997,Positive,0.95,Positive,Positive
Fast delivery and excellent product.,Positive,5,fast delivery and excellent product,Positive,0.5719,Positive,0.6,Positive,Positive
Neither impressed nor disappointed.,Neutral,3,neither impressed nor disappointed,Negative,-0.5724,Positive,0.125,Neutral,Neutral
Great customer support and fantastic product.,Positive,5,great customer support and fantastic product,Positive,0.886,Positive,0.6000000000000001,Positive,Positive
The quality exceeded what I expected at this price point.,Positive,5,the quality exceeded what i expected at this price point,Neutral,0.0,Neutral,-0.1,Positive,Positive
This is the worst purchase I have ever made.,Negative,1,this is the worst purchase i have ever made,Negative,-0.6249,Negative,-1.0,Negative,Negative
"Disgusting quality, sent it back immediately.",Negative,1,disgusting quality sent it back immediately,Negative,-0.5267,Negative,-0.5,Negative,Negative
Horrible experience. Avoid!,Negative,1,horrible experience avoid,Negative,-0.6908,Negative,-1.0,Negative,Negative
It gets the job done but could be better.,Neutral,3,it gets the job done but could be better,Positive,0.5927,Positive,0.5,Neutral,Neutral
An average product that meets basic needs.,Neutral,3,an average product that meets basic needs,Neutral,0.0,Neutral,-0.075,Neutral,Neutral
"Average product, nothing special.",Neutral,3,average product nothing special,Negative,-0.3089,Positive,0.10357142857142858,Neutral,Neutral
The best part is how easy it is to set up.,Positive,5,the best part is how easy it is to set up,Positive,0.7964,Positive,0.7166666666666667,Positive,Positive
I expected a bit more for the price.,Neutral,3,i expected a bit more for the price,Neutral,0.0,Positive,0.2,Neutral,Neutral
Above and beyond what I expected for this price.,Positive,5,above and beyond what i expected for this price,Neutral,0.0,Neutral,-0.05,Positive,Positive
It serves its purpose but I would not buy again.,Neutral,3,it serves its purpose but i would not buy again,Neutral,0.0,Neutral,0.0,Neutral,Neutral
"Very cheaply made, fell apart immediately.",Negative,1,very cheaply made fell apart immediately,Neutral,0.0,Positive,0.52,Negative,Negative
"Useless product, complete waste of money.",Negative,1,useless product complete waste of money,Negative,-0.6808,Negative,-0.20000000000000004,Negative,Negative
The item came broken and returning it was a hassle.,Negative,1,the item came broken and returning it was a hassle,Negative,-0.4767,Negative,-0.4,Negative,Negative
I would give zero stars if I could.,Negative,1,i would give zero stars if i could,Neutral,0.0,Neutral,0.0,Negative,Negative
I expected a bit more for the price.,Neutral,3,i expected a bit more for the price,Neutral,0.0,Positive,0.2,Neutral,Neutral
"Outstanding performance, worth every penny.",Positive,5,outstanding performance worth every penny,Positive,0.7096,Positive,0.4,Positive,Positive
Great customer support and fantastic product.,Positive,5,great customer support and fantastic product,Positive,0.886,Positive,0.6000000000000001,Positive,Positive
"Average product, nothing special.",Neutral,3,average product nothing special,Negative,-0.3089,Positive,0.10357142857142858,Neutral,Neutral
Exceeded my expectations in every way possible.,Positive,5,exceeded my expectations in every way possible,Neutral,0.0,Neutral,0.0,Positive,Positive
"Highly recommended, the customer service was also excellent.",Positive,5,highly recommended the customer service was also excellent,Positive,0.6997,Positive,0.58,Positive,Positive
The quality exceeded what I expected at this price point.,Positive,5,the quality exceeded what i expected at this price point,Neutral,0.0,Neutral,-0.1,Positive,Positive
"This is exactly what I needed, works great.",Positive,5,this is exactly what i needed works great,Positive,0.6249,Positive,0.525,Positive,Positive
Completely dissatisfied with this purchase.,Negative,1,completely dissatisfied with this purchase,Negative,-0.4391,Neutral,0.1,Negative,Negative
Works as described. Fair.,Neutral,3,works as described fair,Positive,0.3182,Positive,0.7,Neutral,Neutral
"Scam product, totally different from the description.",Negative,1,scam product totally different from the description,Negative,-0.5719,Neutral,0.0,Negative,Negative
"Good for basic needs, not for heavy use.",Neutral,3,good for basic needs not for heavy use,Positive,0.4404,Positive,0.16666666666666666,Neutral,Neutral
"It is an okay product, does what it should.",Neutral,3,it is an okay product does what it should,Positive,0.2263,Positive,0.5,Neutral,Neutral
Not exactly what I expected but acceptable.,Neutral,3,not exactly what i expected but acceptable,Positive,0.4497,Negative,-0.1125,Neutral,Neutral
Not bad but not great either.,Neutral,3,not bad but not great either,Negative,-0.5448,Neutral,-0.02500000000000005,Neutral,Neutral
The product is okay but the instructions were confusing.,Neutral,3,the product is okay but the instructions were confusing,Negative,-0.2263,Neutral,0.1,Neutral,Neutral
The size is accurate and the quality is passable.,Neutral,3,the size is accurate and the quality is passable,Neutral,0.0,Positive,0.4000000000000001,Neutral,Neutral
"Completely useless, wasted my money.",Negative,1,completely useless wasted my money,Negative,-0.763,Negative,-0.35,Negative,Negative
The packaging was great and the product works flawlessly.,Positive,5,the packaging was great and the product works flawlessly,Positive,0.7096,Positive,0.9,Positive,Positive
I have mixed feelings about this purchase.,Neutral,3,i have mixed feelings about this purchase,Neutral,0.0,Neutral,0.0,Neutral,Neutral
One of the best products I have ever bought online.,Positive,5,one of the best products i have ever bought online,Positive,0.6369,Positive,1.0,Positive,Positive
"Fell apart during first use, total garbage.",Negative,1,fell apart during first use total garbage,Neutral,0.0,Positive,0.125,Negative,Negative
The size is accurate and the quality is passable.,Neutral,3,the size is accurate and the quality is passable,Neutral,0.0,Positive,0.4000000000000001,Neutral,Neutral
"I love this product, it has made my life so much easier.",Positive,5,i love this product it has made my life so much easier,Positive,0.8062,Positive,0.35,Positive,Positive
It arrived intact and works as intended.,Neutral,3,it arrived intact and works as intended,Positive,0.2023,Neutral,0.0,Neutral,Neutral
"Waste of packaging materials, the product is worthless.",Negative,1,waste of packaging materials the product is worthless,Negative,-0.6908,Negative,-0.5,Negative,Negative
Works but takes some getting used to.,Neutral,3,works but takes some getting used to,Neutral,0.0,Neutral,0.0,Neutral,Neutral
"Average performance, no major complaints.",Neutral,3,average performance no major complaints,Negative,-0.5994,Neutral,-0.090625,Neutral,Neutral
"Works perfectly, highly recommend.",Positive,5,works perfectly highly recommend,Positive,0.7902,Positive,0.16,Positive,Positive
Best investment I have made in a long time.,Positive,5,best investment i have made in a long time,Positive,0.6369,Positive,0.475,Positive,Positive
"Super happy with this purchase, everything works perfectly.",Positive,5,super happy with this purchase everything works perfectly,Positive,0.9153,Positive,0.7111111111111111,Positive,Positive
Works like a charm right out of the box.,Positive,5,works like a charm right out of the box,Positive,0.6369,Positive,0.2857142857142857,Positive,Positive
This product is amazing! Love it!,Positive,5,this product is amazing love it,Positive,0.8402,Positive,0.55,Positive,Positive
"Useless product, complete waste of money.",Negative,1,useless product complete waste of money,Negative,-0.6808,Negative,-0.20000000000000004,Negative,Negative
"Disgusting quality, sent it back immediately.",Negative,1,disgusting quality sent it back immediately,Negative,-0.5267,Negative,-0.5,Negative,Negative
"Superb quality, would buy again.",Positive,5,superb quality would buy again,Positive,0.6249,Positive,1.0,Positive,Positive
"I love this product, it has made my life so much easier.",Positive,5,i love this product it has made my life so much easier,Positive,0.8062,Positive,0.35,Positive,Positive
"Amazing quality and very affordable, highly recommend.",Positive,5,amazing quality and very affordable highly recommend,Positive,0.7818,Positive,0.32,Positive,Positive
"Perfect condition, works exactly as shown in the description.",Positive,5,perfect condition works exactly as shown in the description,Positive,0.5719,Positive,0.625,Positive,Positive
Best purchase I've made this year.,Positive,5,best purchase ive made this year,Positive,0.6369,Positive,1.0,Positive,Positive
"Fantastic purchase, no regrets at all.",Positive,5,fantastic purchase no regrets at all,Neutral,-0.0258,Positive,0.225,Positive,Positive
"Scam product, totally different from the description.",Negative,1,scam product totally different from the description,Negative,-0.5719,Neutral,0.0,Negative,Negative
"Fantastic purchase, no regrets at all.",Positive,5,fantastic purchase no regrets at all,Neutral,-0.0258,Positive,0.225,Positive,Positive
"Terrible purchase, already throwing it away.",Negative,1,terrible purchase already throwing it away,Negative,-0.4767,Negative,-1.0,Negative,Negative
"Good for basic needs, not for heavy use.",Neutral,3,good for basic needs not for heavy use,Positive,0.4404,Positive,0.16666666666666666,Neutral,Neutral
I had high hopes but this was a huge letdown.,Negative,1,i had high hopes but this was a huge letdown,Positive,0.5927,Positive,0.28,Negative,Negative
Works but takes some getting used to.,Neutral,3,works but takes some getting used to,Neutral,0.0,Neutral,0.0,Neutral,Neutral
I had high hopes but this was a huge letdown.,Negative,1,i had high hopes but this was a huge letdown,Positive,0.5927,Positive,0.28,Negative,Negative
Functional but the design could use improvement.,Neutral,3,functional but the design could use improvement,Positive,0.6124,Neutral,0.0,Neutral,Neutral
"Works perfectly, highly recommend.",Positive,5,works perfectly highly recommend,Positive,0.7902,Positive,0.16,Positive,Positive
Works like a charm right out of the box.,Positive,5,works like a charm right out of the box,Positive,0.6369,Positive,0.2857142857142857,Positive,Positive
The item came broken and returning it was a hassle.,Negative,1,the item came broken and returning it was a hassle,Negative,-0.4767,Negative,-0.4,Negative,Negative
It will do for now but I will probably upgrade later.,Neutral,3,it will do for now but i will probably upgrade later,Neutral,0.0,Neutral,0.0,Neutral,Neutral
Decent for the price point.,Neutral,3,decent for the price point,Neutral,0.0,Positive,0.16666666666666666,Neutral,Neutral
"I love this product, it has made my life so much easier.",Positive,5,i love this product it has made my life so much easier,Positive,0.8062,Positive,0.35,Positive,Positive
Functional but the design could use improvement.,Neutral,3,functional but the design could use improvement,Positive,0.6124,Neutral,0.0,Neutral,Neutral
Completely dissatisfied with this purchase.,Negative,1,completely dissatisfied with this purchase,Negative,-0.4391,Neutral,0.1,Negative,Negative
Not exactly what I expected but acceptable.,Neutral,3,not exactly what i expected but acceptable,Positive,0.4497,Negative,-0.1125,Neutral,Neutral
"Amazing quality and very affordable, highly recommend.",Positive,5,amazing quality and very affordable highly recommend,Positive,0.7818,Positive,0.32,Positive,Positive
"Cheap and flimsy, do not recommend at all.",Negative,1,cheap and flimsy do not recommend at all,Negative,-0.2755,Positive,0.4,Negative,Negative
"Fantastic purchase, no regrets at all.",Positive,5,fantastic purchase no regrets at all,Neutral,-0.0258,Positive,0.225,Positive,Positive
Reasonable for a budget option.,Neutral,3,reasonable for a budget option,Neutral,0.0,Positive,0.2,Neutral,Neutral
Not the best but not the worst.,Neutral,3,not the best but not the worst,Positive,0.5035,Neutral,0.0,Neutral,Neutral
Exactly as advertised and works perfectly.,Positive,5,exactly as advertised and works perfectly,Positive,0.6369,Positive,0.625,Positive,Positive
"Thrilled with my purchase, everything is perfect.",Positive,5,thrilled with my purchase everything is perfect,Positive,0.765,Positive,0.8,Positive,Positive
Looks great and works even better.,Positive,5,looks great and works even better,Positive,0.7906,Positive,0.65,Positive,Positive
"Terrible product, broke after one use.",Negative,1,terrible product broke after one use,Negative,-0.7096,Negative,-1.0,Negative,Negative
The item came broken and returning it was a hassle.,Negative,1,the item came broken and returning it was a hassle,Negative,-0.4767,Negative,-0.4,Negative,Negative
Decent for the price point.,Neutral,3,decent for the price point,Neutral,0.0,Positive,0.16666666666666666,Neutral,Neutral
"Disgusting quality, sent it back immediately.",Negative,1,disgusting quality sent it back immediately,Negative,-0.5267,Negative,-0.5,Negative,Negative
Mediocre quality at a reasonable price.,Neutral,3,mediocre quality at a reasonable price,Neutral,0.0,Negative,-0.15,Neutral,Neutral
"Perfect condition, works exactly as shown in the description.",Positive,5,perfect condition works exactly as shown in the description,Positive,0.5719,Positive,0.625,Positive,Positive
Decent product but overpriced in my opinion.,Neutral,3,decent product but overpriced in my opinion,Neutral,0.0,Positive,0.16666666666666666,Neutral,Neutral
